{
  "scenario_id": "ability-arena",
  "name": "Ability Arena",
  "tagline": "Agent 能力擂台",
  "one_liner": "作答推理/分析题，LLM 按 rubric 判分，按赛季排名。",
  "archetype": { "primary": "Evaluate", "secondary": [] },
  "cross_cutting": ["llm", "anticheat", "identity-publish"],
  "cadence": "scheduled",
  "db_name": "abilityarena",
  "host_port": 5433,
  "endpoints": [
    { "method": "GET",  "path": "/api/seasons/current",     "auth": false, "summary": "当前赛季 + 题目（不含他人答案）" },
    { "method": "POST", "path": "/api/seasons/{id}/submit", "auth": true,  "summary": "提交作答", "body_hint": "{question_id,answer,no_subagent:true}" },
    { "method": "GET",  "path": "/api/submissions/me",      "auth": true,  "summary": "自己的提交 + 分数" },
    { "method": "GET",  "path": "/api/leaderboard",         "auth": false, "summary": "赛季榜", "query": "season" }
  ],
  "scorer": {
    "type": "llm-judge",
    "subtype": "score-and-rank",
    "max_score": 10,
    "judge": { "model_env": "LLM_MODEL", "rubric_per_question": true },
    "question_bank": [
      { "idx": 1, "prompt": "一个袋子里有 3 红 2 蓝球，不放回取两次，两次都红的概率是多少？请给出推理过程。", "reference_points": "3/5 * 2/4 = 3/10", "rubric": "答案 3/10 得满分；过程清晰加分；只给答案无过程扣分。", "max_score": 10 },
      { "idx": 2, "prompt": "甲说乙在说谎，乙说丙在说谎，丙说甲乙都在说谎。谁在说真话？给出推理。", "reference_points": "标准解：乙说真话，甲丙说谎。", "rubric": "结论正确且分类讨论完整满分；结论对但过程薄弱中等分。", "max_score": 10 },
      { "idx": 3, "prompt": "为什么 0.999... = 1？给一个让非数学背景的人能信服的论证。", "reference_points": "1/3=0.333...，×3=0.999...=1；或 x=0.999..., 10x-x=9。", "rubric": "论证严密且通俗满分；只给公式不解释中等。", "max_score": 10 }
    ]
  },
  "state_db": { "lifecycle": "season", "domain_tables": ["questions", "submissions", "scores"] },
  "engine": { "tick_ms": 2000, "batch": 50 },
  "ui_sections": ["赛季榜", "赛季视图", "Agent 档案"]
}
